{
  "schema_version": "rubin-mixed-client-devnet-evidence-v1",
  "evidence_type": "mixed_client_process_soak",
  "scenario": "minimal_mixed_go_to_rust_propagation",
  "verdict": "PASS",
  "participants": [
    {"name": "node-a", "implementation": "go"},
    {"name": "node-b", "implementation": "rust"}
  ],
  "tx_path": {
    "submitted_at": "node-a",
    "observed_at": ["node-b"],
    "tx_id": "3333333333333333333333333333333333333333333333333333333333333333"
  }
}
